{
  "version": 3,
  "directed": true,
  "multigraph": true,
  "graph": {
    "name": "Health Check"
  },
  "nodes": [
    {
      "id": "CLIENT",
      "description": "External HTTP caller or operator issuing a liveness/readiness probe: curl, a container healthcheck, or an orchestrator probe. The endpoint is unauthenticated, so no bearer key is required.",
      "group": 1,
      "role": "initiator"
    },
    {
      "id": "UVICORN_SERVER",
      "symbol": "uvicorn.run",
      "description": "Single-process ASGI HTTP server bound to settings.host:settings.port. Accepts the probe connection and hands the ASGI HTTP scope to the FastAPI app.",
      "group": 7,
      "role": "intermediary"
    },
    {
      "id": "FASTAPI_APP",
      "symbol": "create_app",
      "description": "FastAPI ASGI application assembled by create_app; matches the request path to a registered route and serializes the handler result to JSON.",
      "group": 2,
      "role": "intermediary"
    },
    {
      "id": "HEALTH_ROUTE",
      "symbol": "create_app.readiness",
      "description": "Route handlers for the two health paths: liveliness() returns the literal {\"status\": \"ok\"} without reading gateway state, and readiness() asks gateway.ready() before choosing 200 ok or 503 not_ready.",
      "group": 2,
      "role": "sink"
    },
    {
      "id": "GATEWAY",
      "symbol": "Gateway.ready",
      "description": "Application-core readiness predicate: true when at least one configured replica's cooldown deadline is at or before the monotonic clock. Reads no transport and opens no connection.",
      "group": 3,
      "role": "intermediary"
    },
    {
      "id": "REPLICA_STATE",
      "symbol": "Gateway._cooldowns",
      "description": "Process-local map of per-replica cooldown deadlines maintained by chat traffic; an absent entry means the replica was never cooled down and is eligible.",
      "group": 3,
      "role": "intermediary"
    }
  ],
  "links": [
    {
      "source": "CLIENT",
      "target": "UVICORN_SERVER",
      "seq": 1,
      "kind": "call",
      "outcome": "success",
      "phase": "probe",
      "description": "GET /health/liveliness or GET /health/readiness over HTTP; unauthenticated."
    },
    {
      "source": "UVICORN_SERVER",
      "target": "FASTAPI_APP",
      "seq": 2,
      "kind": "call",
      "outcome": "success",
      "phase": "probe",
      "description": "ASGI HTTP scope (method, path) delivered to the app."
    },
    {
      "source": "FASTAPI_APP",
      "target": "HEALTH_ROUTE",
      "seq": 3,
      "kind": "call",
      "outcome": "success",
      "phase": "probe",
      "description": "Route match dispatches /health/liveliness to liveliness() and /health/readiness to readiness()."
    },
    {
      "source": "HEALTH_ROUTE",
      "target": "FASTAPI_APP",
      "seq": 4,
      "kind": "return",
      "outcome": "success",
      "phase": "liveliness",
      "description": "liveliness() returns the literal payload {\"status\": \"ok\"}; the static process check touches no port and no replica state."
    },
    {
      "source": "FASTAPI_APP",
      "target": "UVICORN_SERVER",
      "seq": 5,
      "kind": "return",
      "outcome": "success",
      "phase": "liveliness",
      "description": "200 response with application/json body."
    },
    {
      "source": "UVICORN_SERVER",
      "target": "CLIENT",
      "seq": 6,
      "kind": "return",
      "outcome": "success",
      "phase": "liveliness",
      "description": "HTTP 200 with {\"status\": \"ok\"} returned to the caller."
    },
    {
      "source": "HEALTH_ROUTE",
      "target": "GATEWAY",
      "seq": 7,
      "kind": "call",
      "outcome": "success",
      "phase": "readiness",
      "description": "readiness() calls gateway.ready() before building the response."
    },
    {
      "source": "GATEWAY",
      "target": "REPLICA_STATE",
      "seq": 8,
      "kind": "call",
      "outcome": "success",
      "phase": "readiness",
      "description": "ready() scans the cooldown deadline of every configured model endpoint."
    },
    {
      "source": "REPLICA_STATE",
      "target": "GATEWAY",
      "seq": 9,
      "kind": "return",
      "outcome": "success",
      "phase": "readiness",
      "description": "Cooldown deadlines; endpoints without an entry are eligible."
    },
    {
      "source": "GATEWAY",
      "target": "HEALTH_ROUTE",
      "seq": 10,
      "kind": "return",
      "outcome": "success",
      "phase": "readiness",
      "description": "True when at least one deadline is at or before the current clock value."
    },
    {
      "source": "HEALTH_ROUTE",
      "target": "FASTAPI_APP",
      "seq": 11,
      "kind": "return",
      "outcome": "success",
      "phase": "readiness",
      "description": "Ready branch: JSONResponse 200 {\"status\": \"ok\"}."
    },
    {
      "source": "FASTAPI_APP",
      "target": "UVICORN_SERVER",
      "seq": 12,
      "kind": "return",
      "outcome": "success",
      "phase": "readiness",
      "description": "200 response with application/json body."
    },
    {
      "source": "UVICORN_SERVER",
      "target": "CLIENT",
      "seq": 13,
      "kind": "return",
      "outcome": "success",
      "phase": "readiness",
      "description": "HTTP 200 with {\"status\": \"ok\"} returned to the caller."
    },
    {
      "source": "HEALTH_ROUTE",
      "target": "FASTAPI_APP",
      "seq": 20,
      "kind": "return",
      "outcome": "error",
      "phase": "readiness",
      "description": "Not-ready branch: JSONResponse 503 {\"status\": \"not_ready\"} when ready() is false."
    },
    {
      "source": "FASTAPI_APP",
      "target": "UVICORN_SERVER",
      "seq": 21,
      "kind": "return",
      "outcome": "error",
      "phase": "readiness",
      "description": "503 response with application/json body."
    },
    {
      "source": "UVICORN_SERVER",
      "target": "CLIENT",
      "seq": 22,
      "kind": "return",
      "outcome": "error",
      "phase": "readiness",
      "description": "HTTP 503 with {\"status\": \"not_ready\"} returned to the caller."
    }
  ]
}
